{
  "schemaVersion": "SCOPE-T17-TRACEABILITY/1",
  "result": "PASS",
  "source": {
    "title": "Technical Assessment: Streaming Signal Capture and Playback",
    "pages": 3,
    "sha256": "b6b34fc36fd7db1eac6a1b0b7630a2c35b182a476d6d83ecff38bf1df23220a7",
    "auditedAt": "2026-09-14T09:00:00+05:30"
  },
  "pdfRequirements": [
    {
      "id": "P01",
      "requirement": "Acquire a continuous multichannel signal at a fixed real-time rate, persist without nominal loss, then retrieve and replay it.",
      "status": "verified",
      "implementation": ["core/acquisition.ts", "core/playback.ts"],
      "tests": ["tests/cli.test.mjs", "tests/playback.test.mjs"],
      "evidence": ["docs/evidence/t15/README.md", "docs/evidence/t16/README.md"],
      "reproductionCommand": "npm test",
      "demoTimestamp": "00:35"
    },
    {
      "id": "P02",
      "requirement": "Use Node.js and React.",
      "status": "verified",
      "implementation": ["package.json", "app/page.tsx"],
      "tests": ["tests/browser/t14-workflow.spec.mjs"],
      "evidence": ["README.md"],
      "reproductionCommand": "npm run build",
      "demoTimestamp": "00:15"
    },
    {
      "id": "P03",
      "requirement": "Make channel count and sample rate runtime-configurable and document the mechanism.",
      "status": "verified",
      "implementation": ["core/config.ts", "app/configuration-form.tsx"],
      "tests": ["tests/configuration.test.mjs", "tests/browser/configuration.spec.mjs"],
      "evidence": ["docs/evidence/t02/README.md"],
      "reproductionCommand": "npm test",
      "demoTimestamp": "00:35"
    },
    {
      "id": "P04",
      "requirement": "Generate deterministic values reproducible from a known seed or closed-form function.",
      "status": "verified",
      "implementation": ["core/signal.ts"],
      "tests": ["tests/configuration.test.mjs"],
      "evidence": ["docs/waveform.md"],
      "reproductionCommand": "npm test",
      "demoTimestamp": "00:45"
    },
    {
      "id": "P05",
      "requirement": "Implement generator and recorder as two independent processes.",
      "status": "verified",
      "implementation": ["core/generator.ts", "core/recorder.ts"],
      "tests": ["tests/cli.test.mjs"],
      "evidence": ["docs/evidence/t01/README.md"],
      "reproductionCommand": "npm test",
      "demoTimestamp": "01:20"
    },
    {
      "id": "P06",
      "requirement": "Pace generation at the configured real-world rate rather than maximum machine speed.",
      "status": "verified",
      "implementation": ["core/generator.ts"],
      "tests": ["tests/cli.test.mjs"],
      "evidence": ["docs/evidence/t15/run-summary.json"],
      "reproductionCommand": "npm run benchmark:acquisition -- --workload quiet",
      "demoTimestamp": "01:00"
    },
    {
      "id": "P07",
      "requirement": "Keep the source timeline independent of recorder throughput or backpressure.",
      "status": "verified",
      "implementation": ["core/generator.ts", "core/recorder.ts"],
      "tests": ["tests/overload.test.mjs"],
      "evidence": ["docs/evidence/t05/README.md"],
      "reproductionCommand": "npm test",
      "demoTimestamp": "01:05"
    },
    {
      "id": "P08",
      "requirement": "Document pacing strategy and report timing accuracy over a sustained run.",
      "status": "verified",
      "implementation": ["docs/overload.md"],
      "tests": ["tests/benchmark.test.mjs"],
      "evidence": ["docs/evidence/t15/run-summary.json"],
      "reproductionCommand": "npm run evidence:validate-acquisition",
      "demoTimestamp": "05:30"
    },
    {
      "id": "P09",
      "requirement": "Continuously ingest recordings with no fixed run-duration limit.",
      "status": "verified",
      "implementation": ["core/acquisition.ts", "core/cli.ts"],
      "tests": ["tests/cli.test.mjs"],
      "evidence": ["README.md"],
      "reproductionCommand": "npm run cli -- record recordings/continuous",
      "demoTimestamp": "00:50"
    },
    {
      "id": "P10",
      "requirement": "Persist samples to disk.",
      "status": "verified",
      "implementation": ["core/recorder.ts", "core/storage.ts"],
      "tests": ["tests/cli.test.mjs"],
      "evidence": ["docs/recording-format.md"],
      "reproductionCommand": "npm test",
      "demoTimestamp": "01:10"
    },
    {
      "id": "P11",
      "requirement": "Maintain steady-state recording memory independent of duration.",
      "status": "verified",
      "implementation": ["core/generator.ts", "core/recorder.ts"],
      "tests": ["tests/benchmark.test.mjs"],
      "evidence": ["docs/evidence/t15/run-summary.json"],
      "reproductionCommand": "npm run evidence:validate-acquisition",
      "demoTimestamp": "05:30"
    },
    {
      "id": "P12",
      "requirement": "Document a buffering upper bound and defined overload behavior.",
      "status": "verified",
      "implementation": ["core/contracts.ts", "docs/overload.md"],
      "tests": ["tests/overload.test.mjs"],
      "evidence": ["docs/evidence/t05/README.md"],
      "reproductionCommand": "npm test",
      "demoTimestamp": "01:15"
    },
    {
      "id": "P13",
      "requirement": "Detect and report dropped-sample counts and positions.",
      "status": "verified",
      "implementation": ["core/recorder.ts", "core/verify.ts"],
      "tests": ["tests/overload.test.mjs"],
      "evidence": ["docs/evidence/t15/losses.jsonl"],
      "reproductionCommand": "npm test",
      "demoTimestamp": "01:15"
    },
    {
      "id": "P14",
      "requirement": "Terminate cleanly on interrupt, flushing buffered data and readable metadata.",
      "status": "verified",
      "implementation": ["core/acquisition.ts", "core/cli.ts"],
      "tests": ["tests/cli.test.mjs", "tests/failures.test.mjs"],
      "evidence": ["docs/evidence/t04/README.md"],
      "reproductionCommand": "npm test",
      "demoTimestamp": "01:35"
    },
    {
      "id": "P15",
      "requirement": "Show zero loss nominally and state the accepted overload-loss policy and rationale.",
      "status": "verified",
      "implementation": ["docs/overload.md"],
      "tests": ["tests/overload.test.mjs"],
      "evidence": ["docs/evidence/t15/run-summary.json"],
      "reproductionCommand": "npm run evidence:validate-acquisition",
      "demoTimestamp": "01:35"
    },
    {
      "id": "P16",
      "requirement": "Make a recording fully interpretable without source-code access.",
      "status": "verified",
      "implementation": ["docs/recording-format.md", "docs/waveform.md"],
      "tests": ["tests/inspection.test.mjs"],
      "evidence": ["README.md"],
      "reproductionCommand": "npm test",
      "demoTimestamp": "02:00"
    },
    {
      "id": "P17",
      "requirement": "Convey channel count, sample rate, total sample count, duration, numeric type/width/byte order, layout, and start timestamp.",
      "status": "verified",
      "implementation": ["core/contracts.ts", "core/metadata.ts"],
      "tests": ["tests/inspection.test.mjs"],
      "evidence": ["docs/recording-format.md"],
      "reproductionCommand": "npm test",
      "demoTimestamp": "02:00"
    },
    {
      "id": "P18",
      "requirement": "Retrieve arbitrary time ranges and channel subsets without a full scan where layout permits, and describe extra reads.",
      "status": "verified",
      "implementation": ["core/storage.ts"],
      "tests": ["tests/range.test.mjs"],
      "evidence": ["docs/evidence/t16/summary.json"],
      "reproductionCommand": "npm run evidence:validate-long-recording",
      "demoTimestamp": "02:25"
    },
    {
      "id": "P19",
      "requirement": "Document bytes per sample and numeric-representation rationale.",
      "status": "verified",
      "implementation": ["docs/recording-format.md"],
      "tests": ["tests/inspection.test.mjs"],
      "evidence": ["README.md"],
      "reproductionCommand": "npm test",
      "demoTimestamp": "05:35"
    },
    {
      "id": "P20",
      "requirement": "Document approximate one-hour size at default parameters.",
      "status": "verified",
      "implementation": ["docs/recording-format.md"],
      "tests": ["tests/benchmark.test.mjs"],
      "evidence": ["docs/evidence/t15/metadata.json"],
      "reproductionCommand": "npm run evidence:validate-acquisition",
      "demoTimestamp": "05:35"
    },
    {
      "id": "P21",
      "requirement": "Document format rationale and rejected alternatives.",
      "status": "verified",
      "implementation": [
        "docs/recording-format.md",
        "docs/adr/0002-bounded-transport-and-indexed-frames.md"
      ],
      "tests": ["tests/inspection.test.mjs"],
      "evidence": ["README.md"],
      "reproductionCommand": "npm test",
      "demoTimestamp": "05:35"
    },
    {
      "id": "P22",
      "requirement": "Document interruption behavior and partial readability of truncated files.",
      "status": "verified",
      "implementation": ["docs/failure-handling.md", "docs/recording-format.md"],
      "tests": ["tests/inspection.test.mjs", "tests/failures.test.mjs"],
      "evidence": ["docs/evidence/t04/README.md"],
      "reproductionCommand": "npm test",
      "demoTimestamp": "05:40"
    },
    {
      "id": "P23",
      "requirement": "Inspect recording metadata.",
      "status": "verified",
      "implementation": ["core/storage.ts", "app/recording-details.tsx"],
      "tests": ["tests/inspection.test.mjs", "tests/browser/library.spec.mjs"],
      "evidence": ["docs/evidence/t03/README.md"],
      "reproductionCommand": "npm test",
      "demoTimestamp": "01:55"
    },
    {
      "id": "P24",
      "requirement": "Retrieve intervals by time or original sample index.",
      "status": "verified",
      "implementation": ["core/storage.ts", "app/range-inspector.tsx"],
      "tests": ["tests/range.test.mjs"],
      "evidence": ["docs/evidence/t08/README.md"],
      "reproductionCommand": "npm test",
      "demoTimestamp": "02:20"
    },
    {
      "id": "P25",